title,description,price,stock,category
Ropa Formal Situation,Current especially role election husband sound eat.,96.55,18,Formal Wear
Faldas Indeed,Message surface lot today old become.,28.48,29,Bottoms
Camisas With,Born material represent tell do remain.,106.27,35,Tops
Camisas Whose,Tv new campaign finally speech stock.,34.75,30,Tops
Pantalones Exist,Scene today same upon although.,123.01,92,Bottoms
Chaquetas Enough,Doctor magazine animal data size including book.,32.03,85,Outerwear
Ropa Deportiva Business,Year still cause again.,49.02,9,Sportswear
Chaquetas de Anime Cultural,Him father scientist road.,14.16,68,Anime Collection
Pantalones Control,Then discuss art professional sure.,34.71,19,Bottoms
Playeras con Personajes de Anime Executive,Film movement describe fall large customer.,73.9,48,Anime Collection
Gorros Structure,Try imagine middle always rule responsibility.,46.75,42,Accessories
Vestidos Elegantes Her,Wrong audience hour power expect room.,125.9,33,Dresses
Vestidos Elegantes Wind,Thank on order popular morning up personal.,101.93,33,Dresses
Gorros Result,Arrive win increase kid media gun local.,33.75,31,Accessories
Camisas Anime Low,Back professor bed include.,44.6,14,Anime Collection
Accesorios Positive,Staff talk like act.,133.49,34,Accessories
Calzado While,Size age not three near report.,12.84,52,Footwear
Pantalones Own,Collection reach soldier option spring.,71.57,44,Bottoms
Carteras Series,Well gun financial beat indeed four.,102.02,25,Accessories
Bufandas Ahead,International great follow different.,11.83,30,Accessories
Gorros Trade,Ok suffer turn customer race group.,45.16,63,Accessories
Camisas Anime However,Indeed art any agent billion recognize.,84.07,58,Anime Collection
Ropa Estilo K-Pop Boy,Rather policy letter order job occur.,20.89,33,K-Pop Style
Camisas Would,Herself about security purpose bank.,98.23,38,Tops
Carteras Truth,Indicate dark any again out culture decide.,106.7,88,Accessories
Vestidos Ok,Best marriage born mind Democrat already section.,140.95,46,Dresses
Chaquetas de Anime Will,History task last subject agency business.,24.77,32,Anime Collection
Camisas Deep,Door brother want my.,47.88,34,Tops
Gorros Real,End majority response.,112,8,Accessories
Ropa Oversize Go,After purpose respond bed choice smile.,87.51,20,Oversized
Ropa Deportiva Head,Represent they teach indicate.,58.16,87,Sportswear
Pantalones Cargo Hotel,Test appear note.,44.62,56,Bottoms
Calzado Budget,Throw personal employee reduce.,129.78,95,Footwear
Zapatillas Urbanas Without,Allow agreement budget affect.,70.51,58,Footwear
Carteras Night,Black kind authority resource whatever police.,146.23,92,Accessories
Chaquetas Rich,Knowledge herself seek skin what.,81.93,88,Outerwear
Chaquetas Administration,Address leader interest big government understand.,106.49,74,Outerwear
Bufandas Think,Mouth near for two writer.,79.45,35,Accessories
Calzado Other,Action candidate wind arrive.,28.86,68,Footwear
Pantalones Cargo Agree,Major than blue investment.,143.8,99,Bottoms
Chaquetas Down,Huge according who.,57.2,18,Outerwear
Gorros System,Personal scene charge hope structure like.,97.41,72,Accessories
Ropa Casual Education,Quickly million involve mission any support.,97.69,32,Casual Wear
Camisas Anime Ball,Possible create all college.,108.88,67,Anime Collection
Sudaderas con Estampados Still,Feel song eat force.,89.35,82,Tops
Ropa Casual Worker,Standard Mr let forget.,52.89,6,Casual Wear
Carteras Else,Leg board outside family necessary what.,66.62,89,Accessories
Carteras Upon,Tonight allow painting I effort unit fund.,135.4,97,Accessories
Chaquetas Party,Office her customer space.,21.4,7,Outerwear
Chaquetas de Anime Change,Attention organization responsibility whose.,56.99,55,Anime Collection
Pantalones Tv,Must range response easy place official too.,87.45,35,Bottoms
Playeras con Personajes de Anime Drug,She us run since seek.,67.4,17,Anime Collection
Ropa Interior Spend,Food government material product bed able.,71.96,52,Underwear
Pantalones Yes,Follow computer type process.,146.28,32,Bottoms
Chaquetas Agreement,Floor computer out south race quite ball card.,61.18,15,Outerwear
Gorros Room,View a whom response wind letter.,68.81,57,Accessories
Calzado Sing,Effort successful development campaign.,58.08,43,Footwear
Accesorios Loss,Travel discuss method yeah section different institution store.,136.68,20,Accessories
Playeras con Personajes de Anime Tonight,Near establish together room.,47.54,34,Anime Collection
Pantalones Cargo Cause,Tv too yard ahead area scene democratic.,64.62,77,Bottoms
Lencería Kid,Total maintain quite anything nice.,111.39,85,Underwear
Vestidos Elegantes Third,Artist plan anyone capital statement discuss.,86.62,40,Dresses
Ropa Interior Dog,Institution something at season necessary work.,140.68,55,Underwear
Botas Offer,Too moment project tough.,87.89,42,Footwear
Chaquetas Book,Picture big coach upon still administration all.,148.56,10,Outerwear
Ropa Deportiva Beat,Catch key able interview reason.,138.73,82,Sportswear
Vestidos Show,Grow administration argue respond compare really us determine.,56.4,62,Dresses
Bufandas Tend,Pull some collection white doctor size cold.,126.2,32,Accessories
Ropa Interior Fire,Name all yard for nor everybody second experience.,122.2,58,Underwear
Ropa Formal Rate,Federal his need not call ten exactly during.,77.99,7,Formal Wear
Ropa Oversize Include,Environmental move political institution arrive mother responsibility.,98,14,Oversized
Ropa Interior Growth,Century all skill since.,95.08,40,Underwear
Chaquetas Raise,Send finish certain scene Congress miss suffer prevent.,112.12,63,Outerwear
Carteras Message,Indicate see institution.,56.36,74,Accessories
Camisas Anime Right,Sound born hope chair health.,144.31,78,Anime Collection
Pantalones Cargo Dream,Well whole month important last add meeting.,53.87,30,Bottoms
Vestidos Impact,Sit indicate while Democrat somebody describe star.,46.12,83,Dresses
Camisas Anime Interest,Down option process technology evidence analysis drop.,117.99,31,Anime Collection
Accesorios Owner,Drop player decade blood.,31.11,35,Accessories
Carteras Author,Spend pretty training chair movement.,137.99,12,Accessories
Botas Interesting,If recognize hot shake.,121.86,67,Footwear
Ropa Casual In,One including capital address only.,137.21,70,Casual Wear
Ropa Estilo K-Pop Cover,Always finally police play move third.,33.14,81,K-Pop Style
Chaquetas de Anime Seem,Young owner what level tax public wall personal.,99.58,68,Anime Collection
Pantalones Off,I loss explain success door early budget.,69.76,65,Bottoms
Ropa Formal International,Also nation finish strategy.,84.29,29,Formal Wear
Faldas Heart,Miss performance still.,72.16,99,Bottoms
Ropa Oversize Health,Imagine figure organization work he.,40.13,98,Oversized
Ropa Deportiva Future,Value add its security.,127.92,42,Sportswear
Ropa Interior Foreign,Left long this in between.,101.82,68,Underwear
Camisas Anime Happy,Wait little despite effect if number.,42,46,Anime Collection
Camisas Blue,Treatment control next affect.,20.32,43,Tops
Playeras con Personajes de Anime Area,Left past bank set avoid admit.,21.97,6,Anime Collection
Playeras con Personajes de Anime Break,Responsibility short nor idea human technology name.,23.85,46,Anime Collection
Bufandas Purpose,Ready difficult age.,12.68,94,Accessories
Playeras con Personajes de Anime Sense,Chance answer fish nothing quickly meeting.,109.88,58,Anime Collection
Ropa Oversize Just,Shoulder knowledge impact high citizen understand eye apply.,12.88,13,Oversized
Ropa Casual Never,Sport certainly network after piece scientist.,28.79,74,Casual Wear
Carteras Huge,Buy accept option knowledge impact seven million.,74.95,97,Accessories
Carteras Play,Magazine think trial various day prove.,113.01,31,Accessories